<?xml version="1.0" encoding="UTF-8"?>

<xsd:schema xmlns:xsd="http://www.w3.org/2001/XMLSchema"
    elementFormDefault="qualified">
    <xsd:simpleType name="latType">
        <xsd:restriction base="xsd:decimal">
            <xsd:minInclusive value="-90" />
            <xsd:maxInclusive value="90" />
            <xsd:fractionDigits value="6"/>
        </xsd:restriction>
    </xsd:simpleType>

    <xsd:simpleType name="lonType">
        <xsd:restriction base="xsd:decimal">
            <xsd:minInclusive value="-180" />
            <xsd:maxInclusive value="180" />
            <xsd:fractionDigits value="6"/>
        </xsd:restriction>
    </xsd:simpleType>

    <xsd:simpleType name="cityType">
        <xsd:restriction base="xsd:string">
            <xsd:pattern value="([a-žA-Ž])+" />
        </xsd:restriction>
    </xsd:simpleType>

    <xsd:simpleType name="streetType">
        <xsd:restriction base="xsd:string">
            <xsd:pattern value="([a-žA-Ž])+" />
        </xsd:restriction>
    </xsd:simpleType>

    <xsd:simpleType name="stNumType">
        <xsd:restriction base="xsd:string">
            <xsd:pattern value="[1-9]([0-9])*([A-Z])?" />
        </xsd:restriction>
    </xsd:simpleType>

    <xsd:simpleType name="priceValueType">
        <xsd:restriction base="xsd:decimal">
            <xsd:minInclusive value="1" />
        </xsd:restriction>
    </xsd:simpleType>

    <xsd:simpleType name="userNameType">
        <xsd:restriction base="xsd:string">
            <xsd:pattern value="([a-zA-Z0-9])+"/>
        </xsd:restriction>
    </xsd:simpleType>

    <xsd:simpleType name="passwordType">
        <xsd:restriction base="xsd:string">
            <xsd:pattern value="([a-zA-Z0-9])+"/>
        </xsd:restriction>
    </xsd:simpleType>

    <xsd:simpleType name="nameType">
        <xsd:restriction base="xsd:string">
            <xsd:pattern value="([a-žA-Ž])+"/>
        </xsd:restriction>
    </xsd:simpleType>

    <xsd:simpleType name="roleType">
        <xsd:restriction base="xsd:string">
            <xsd:enumeration value="user"/>
            <xsd:enumeration value="admin"/>
        </xsd:restriction>
    </xsd:simpleType>

    <xsd:element name="fastfood-database" type="ffDatabase">
        <xsd:key name="jointIDUnique">
            <xsd:selector xpath="joints/joint" />
            <xsd:field xpath="@id" />
        </xsd:key>
        <xsd:key name="mealUniqueID">
            <xsd:selector xpath="meals/meal" />
            <xsd:field xpath="@id" />
        </xsd:key>
        <xsd:keyref name="mealRef" refer="mealUniqueID">
                    <xsd:selector xpath="joints/joint/menu/menu-item" />
                    <xsd:field xpath="@meal-ref" />
        </xsd:keyref>
        <xsd:keyref name="userRef" refer="userIDUnique">
            <xsd:selector xpath="joints/joint"/>
            <xsd:field xpath="@added-by"/>
        </xsd:keyref>
        <xsd:key name="userIDUnique">
            <xsd:selector xpath="users/user"/>
            <xsd:field xpath="@id"/>
        </xsd:key>
    </xsd:element>

    <xsd:complexType name="ffDatabase">
        <xsd:sequence>
            <xsd:element name="joints" type="jointsType" minOccurs="1" maxOccurs="1" />
            <xsd:element name="meals" type="mealsType" minOccurs="1" maxOccurs="1"/>
            <xsd:element name="users" type="usersType" minOccurs="1" maxOccurs="1"/>
        </xsd:sequence>
        <xsd:attribute name="joints-key-number" type="xsd:positiveInteger" use="required" />
        <xsd:attribute name="meals-key-number" type="xsd:positiveInteger" use="required" />
        <xsd:attribute name="users-key-number" type="xsd:positiveInteger" use="required" />
    </xsd:complexType>

    <xsd:complexType name="jointsType">
        <xsd:sequence>
            <xsd:element name="joint" type="jointType" minOccurs="0" maxOccurs="unbounded">
                <xsd:unique name="refUnique">
                    <xsd:selector xpath="menu/menu-item"/>
                    <xsd:field xpath="@meal-ref"/>
                </xsd:unique>
            </xsd:element>
        </xsd:sequence>
    </xsd:complexType>

    <xsd:complexType name="jointType">
        <xsd:sequence minOccurs="1">
            <xsd:element name="location" type="locationType" />
            <xsd:element name="opening-hours" type="hoursType" />
            <xsd:element name="menu" type="menuType" />
            <xsd:element name="tags" type="tagsType" />
            <xsd:element name="comments" type="commentsType" />
            <xsd:element name="web-page" type="xsd:anyURI" />
        </xsd:sequence>
        <xsd:attribute name="id" type="xsd:positiveInteger" use="required" />
        <xsd:attribute name="name" type="xsd:string" use="required" />
        <xsd:attribute name="added-by" type="xsd:positiveInteger"/>
    </xsd:complexType>

    <xsd:complexType name="locationType">
        <xsd:sequence minOccurs="1">
            <xsd:element name="adress" type="adressType" />
        </xsd:sequence>
        <xsd:attribute name="lat" type="latType" use="required" />
        <xsd:attribute name="lon" type="lonType" use="required" />
    </xsd:complexType>

    <xsd:complexType name="adressType">
        <xsd:sequence minOccurs="1">
            <xsd:element name="city" type="cityType" />
            <xsd:element name="street-name" type="streetType" />
            <xsd:element name="street-number" type="stNumType" />
        </xsd:sequence>
    </xsd:complexType>

    <xsd:complexType name="hoursType">
        <xsd:sequence>
            <xsd:element name="mon" type="dayHoursType"/>
            <xsd:element name="tue" type="dayHoursType"/>
            <xsd:element name="wed" type="dayHoursType"/>
            <xsd:element name="thu" type="dayHoursType"/>
            <xsd:element name="fri" type="dayHoursType"/>
            <xsd:element name="sat" type="dayHoursType"/>
            <xsd:element name="sun" type="dayHoursType"/>
        </xsd:sequence>
    </xsd:complexType>

    <xsd:complexType name="dayHoursType">
        <xsd:sequence>
            <xsd:element name="open-span" type="openSpanType" minOccurs="1" maxOccurs="2" />
        </xsd:sequence>
    </xsd:complexType>

    <xsd:complexType name="openSpanType">
        <xsd:sequence minOccurs="1">
            <xsd:element name="start" type="xsd:time" />
            <xsd:element name="end" type="xsd:time" />
        </xsd:sequence>
    </xsd:complexType>

    <xsd:complexType name="menuType">
        <xsd:sequence>
            <xsd:element name="menu-item" type="itemType" minOccurs="1" maxOccurs="unbounded">
            </xsd:element>
        </xsd:sequence>
    </xsd:complexType>

    <xsd:complexType name="itemType">
        <xsd:sequence>
            <xsd:element name="price" type="priceType" minOccurs="1" maxOccurs="unbounded"/>
        </xsd:sequence>
        <xsd:attribute name="meal-ref" type="xsd:positiveInteger" use="required"/>
    </xsd:complexType>

    <xsd:complexType name="priceType">
        <xsd:simpleContent>
            <xsd:extension base="priceValueType">
                <xsd:attribute name="from" type="xsd:time" use="optional" default="00:00:00"/>
                <xsd:attribute name="to" type="xsd:time" use="optional" default="23:59:59"/>
            </xsd:extension>
        </xsd:simpleContent>
    </xsd:complexType>

    <xsd:complexType name="tagsType">
        <xsd:sequence minOccurs="1">
            <xsd:element name="tag" type="xsd:string" maxOccurs="unbounded" minOccurs="0" />
        </xsd:sequence>
    </xsd:complexType>

    <xsd:complexType name="commentsType">
        <xsd:sequence>
            <xsd:element name="comment" type="xsd:string" maxOccurs="unbounded" minOccurs="0" />
        </xsd:sequence>
    </xsd:complexType>

    <xsd:complexType name="mealsType">
        <xsd:sequence>
            <xsd:element name="meal" type="mealType" minOccurs="0" maxOccurs="unbounded"/>
        </xsd:sequence>
    </xsd:complexType>

    <xsd:complexType name="mealType">
        <xsd:all minOccurs="0">
            <xsd:element name="description" type="xsd:string" />
        </xsd:all>
        <xsd:attribute name="id" type="xsd:positiveInteger" use="required" />
        <xsd:attribute name="name" type="xsd:string" use="required" />
    </xsd:complexType>

    <xsd:complexType name="usersType">
        <xsd:sequence>
            <xsd:element name="user" type="userType" minOccurs="1" maxOccurs="unbounded"/>
        </xsd:sequence>
    </xsd:complexType>

    <xsd:complexType name="userType">
        <xsd:sequence>
            <xsd:element name="username" type="userNameType"/>
            <xsd:element name="password" type="passwordType"/>
            <xsd:element name="role" type="roleType"/>
            <xsd:element name="first-name" type="nameType"/>
            <xsd:element name="surname" type="nameType"/>
            <xsd:element name="date-registered" type="xsd:date"/>
            <xsd:element name="active" type="xsd:boolean" />
        </xsd:sequence>
        <xsd:attribute name="id" type="xsd:positiveInteger" use="required"/>
    </xsd:complexType>

</xsd:schema>
